黄砂,黄砂の観測は、各地の気象台で目視で確認した時を黄砂として観測している。,丸
黄砂,黄砂分布の予測は、黄砂の舞い上がりから、上空の風の流れに従って移動すると仮定して予想している,移動や拡散、効果の過程などを組み込んだ数値モデルをも言いいている
黄砂,気象庁で用いられる数値モデルは、水平解像度が20kmの全球モデルと同じである,40km
黄砂,黄砂分布の予測は、52時間先（3日先）までの黄砂の濃度などを予測しています、,96時間先 4日
黄砂,冬の季節には観測されない,"11,12,1,2,3月も過去には観測されている"
黄砂,春に多く観測される。,される。
黄砂,黄砂の初日の平均値は3月初旬である,初終日の統計は実施していない
ヒートアイランド現象,大都市で気温が長期的に上昇しているとみられ、特に日の最高気温の上昇率が大きい,最低気温
ヒートアイランド現象,気温の長期的な上昇は夏に最大となる都市が多い,夏に最小になる
ヒートアイランド現象,長期的には、冬日は変化しないが、熱帯夜や真夏日猛暑日は増加している,冬日は減少していると思われる。
ヒートアイランド現象,都市化により、相対湿度が長期的に上昇している,低下している
ヒートアイランド現象,相対湿度の低下率は、真夏に最小となる都市が多い,梅雨時期
ヒートアイランド現象,霧日数は減少しているとみられる。,
ヒートアイランド現象,多くの都市で降水量や大雨に有意な長期的変化がみられる,みられない
ヒートアイランド現象,人工被覆域は、植生域と比べて日射による熱の蓄積が少なく、また、暖まりにやすく冷えやすい性質がある（熱容量が小さい）,人工被覆域は、植生域と比べて日射による熱の蓄積が多く、また、暖まりにくく冷えにくい性質がある（熱容量が大きい）
ヒートアイランド現象,日中に蓄積した熱を夜間になっても保持し、大気へ放出することになるため、夜間の気温の低下を妨げることになります。,
ヒートアイランド現象,都心部で人口が集中する地域では、昼間の排熱量は1kW/m^2に達すると見積もられる。,100w/m^2
オゾン層観測,ブリュワー分光光度計は、昭和基地で使用されている,日本の札幌つくば那覇
オゾン層観測,ドブソン分光光度計は、昭和基地で使用されている,まる
オゾン層観測,分光光度計では、上空オゾン層の高度分布を観測するこできない,日の出や日没の前後で連続帝に測定することで可能 5ｋｍごと
オゾン層観測,オゾンゾンデは、オゾンがヨウ化カリウム溶液中で化学反応するときの抵抗の変化を利用する,電流が発生する
オゾン層観測,衛星による観測は静止衛星軌道上で、地表や大気におって反射散乱されるう太陽紫外線の強度を測定することでオゾン全量を観測する,極軌道 700ｋｍ上空
日射・赤外放射,下向き赤外放射は、地表面から大気中の雲や二酸化炭素へ放射されるエネルギーである,大気中の空気分子・雲・二酸化炭素等から放射される長波（赤外）放射のうち、地表面へ向かう成分
日射・赤外放射,観測は、国内4地点である,5地点 札幌 つくば 福岡 石垣島 南鳥島
観測,気象観測機器は製造時における器差はない,ある
観測,観測機器の偶然誤差、個々の測器や測定条件の違いによって現れる。,観測機器の系統誤差
観測,系統誤差、気象測器の構造上避けられないものである,観測機器の偶然誤差
観測,系統誤差、観測者が目で読み取って数値を得る場合に、観測者個人の癖によって系統的に発生する誤差である,観測機器の個別の誤差
観測,観測機器の数値の読み取りは、瞬間的に行い、平衝するまでの時間を補正する。,時定数を考慮した観測方法を行う
観測,風速計の場合は、時定数は風速にほぼ比例して変化する,反比例
観測,風速と時定数商はほぼ一定であり、これを距離定数と呼ぶ,風速と時定数の積
観測,風速計の場合は、距離定数で速記の応答の速さをあらわす,
観測,突風率は、一般的に2倍から4倍である,1.5倍から2倍
観測,風光風速計は、地上15mの高さに設置するのが標準となっている,10m
観測,雨量計を高い建物の屋上に設置する場合では、建物からの影響を排除するために最も端に設置する,風の影響が強まるので、少なくとも1m 3m以上端から話す。
観測,降水観測は、気温や気圧といった気象要素と同様に、極地性が低く時間的な変動も小さい,極地性が高く時間的な変動も大きい
観測,夏季のひょうや氷あられは積もると積雪として観測される。,されない
観測,転倒ます型雨量計の温水式は、受水器のの周囲を二重構造にして、ここに油を満たしてヒーター等で10度前後に保って雪などを溶かす,受水器と漏斗の周囲 不凍液  ５度前後
観測,転倒ます型雨量計の溢水式は、受水器内が二重構造になっており、、内側に水と水が蒸発しないように表面に油が浮かせてあり、外側に不凍液がたくわえられていて、ヒーター等で５度前後に温められており、受水器内の水と油を加熱している,１０度
観測,雪尺による計測は、雪尺付近の積雪量を計測する,盛り上がりが発生するため、雪尺から数十センチ離れた平均的雪面の高さを推定して読み取る
観測,超音波式積雪系は、超音波の伝播速度は空気の温度に依存するため、地面側に温度計が設置されている。,超音波送受信機の近傍に温度計を設置する。気象庁では露天で測定した気温を用いている。
観測,積雪計を設置する場所は、都市部での積雪量を模擬するために、鉄板やコンクリートを敷く。,自然な状態にする
観測,雨量計の設置場所は、近くに建物がある場合は、その建物の高さ分だけ離れた位置に設置する,少なくとも2倍以上 できれば4倍以上
観測,雨量計は、地面による風の乱れを避けるために、できるだけ高く設置する,風の影響を受けないように低く設置する
観測,雨量計の誤差の原因で最も大きいのは、受水器からの蒸発による損失である,受水口上での風速の増大及び風の乱れによる降水捕捉率の低下
観測,雨量計で補足できない降水量は最大20% 雪では 80%に達成する,2～10%      10～50%
観測,降水強度・降水量は、気象レーダーからの見通しの良い範囲なら、地上で測定した値と差はない,2～5倍程度ある
観測,気温は、細かく見ると数秒の中でも1～2度の幅で変動している,
観測,温度計の時定数は、一般的に10秒から60秒のものが多く使われる,30秒から180秒
観測,温度計の設置高さは、温度計の観測部が1.5mの高さである,二重円筒の底面
観測,温度計の痛風筒はファンにより通風されており、その速度は2m/sである,5m/s
観測,温度計の設置場所は、風のよどみ点による温度上昇を避けるために、建物の屋上への設置が推奨される,屋上への設置は避ける
観測,電気式湿度計は、高分子膜に含まれる水分の蒸発量が変化し、これによる誘電率が変化することから相対湿度を測定する。,高分子膜に含まれる水分量
観測,風速 風向計の観測間隔は、100Hzである ,0.25秒
観測,現代の風向計の角度検知は、抵抗式ロータリーエンコーダーを用いている,セルシンモーター 光エンコーダー
観測,風向計の矢羽は、２枚式の方が良いとされている,
観測,風向風速計の設置場所は、建物や木々などの障害物との距離は、障害物の高さの少なくとも20倍以上あることが望ましい,10倍
観測,塩化リチウム露点計は、塩化リチウム水溶液の飽和蒸気圧と大気の蒸気圧が等しい温度から露点温度を求める,
観測,塩化リチウム露点計の時定数は1分程度である,2～3分程度
観測,塩化リチウム露点計の時定数から、連続記録は得られない,連続記録が得られ、隔測も可能であるため自動観測に適している
観測,塩化リチウム露点計の時定数から、水溶液の飽和温度が気温より低いあ場合は露点温度を測定できない,
観測,塩化リチウム露点計も温度計同様に5m/s程度の下からの強制通風を行う必要がある,0.15m/s程度 0.2m/s程度となると感部表面の平衡状態がくずれる。
観測,日射計は、黒色受光麺で吸収して熱エネルギーに変換し、温度基準点である白色反射麺との温度差を熱電堆によって起電力として出力する。,
観測,アメダスでは太陽電池式日照計を使用している。,
観測,視程は、全方位の測定値の中で平均値をその観測時の視程とする。,最小値
観測,空港での視程の観測には、透過式を用い、基線長さ75mまたは150mの透過率計を用いている。,175m& 152.4m
観測,視程は、夜間では暗くなって目標が見えないことの影響を取り入れる。,夜間の視程は、昼間と同じ明るさと仮定した場合で、暗くなって目標が見えないことには白湯されない。
観測,視程は、光源から照射された光が大気や浮遊する粒子によって散乱吸収され減衰し、もとの強さの10%になるまでの距離を大気消散係数という,0.05
観測,大気消散係数と視程は合致しない,
観測,視程は、1kmまでは100m単位 1km以上は500m単位で観測する,50m 100m    km単位
観測,雲量は、濃霧のため全く空が見えない場合は、これを雲と同様にみなして雲量10とする。,
観測,雲量は、霧を通して、あるいは霧のない部分から天空あるいは雲が見える場合は、その程度に応じて雲量を決める。,
観測,運良は、煙霧、黄砂などが天空の全体又は一部を覆い’雲を判別できない場合は、濃霧の場合と同様にそこに雲があるとみなして雲量を決める。,
天気,凍雨は、しゅう雨として降る,降らない
天気,氷あられは、しゅう雨として降ることもある,常にしゅう雨性降雨として起こる
天気,ひょうは、雷電に伴って降る。,それはそう
天気,細氷は、水平視程は激しく変動し、その下限は500mの濃霧である,激しく変動するが、下限は1km程度
天気,氷霧はダイアモンドダストである,ちがう
天気,霜は大気中の水蒸気が凝結して地面又は地物に付着して凍結したもの,大気中の水蒸気が昇華して付着したもの
天気,かさ（日のかさ 月のかさ）は大気中に浮遊する水滴のために光が屈折または反射して生ずる,浮遊する氷の結晶
検定,電気式気圧計の検定有効期限は、5年である,10年
検定,風杯式 風車型風速計の検定有効期間は5年であるが、超音波式は10年である,風速計は5年
検定,転倒枡形雨量計の検定有効期限は、動作部が多いので2年である,5年
検定,ラジオゾンデ用機器の有効期限は2年である,1年
検定,複合気象測器検定の有効期限は、これを構成する各気象測器の平均値の期間である,もっとも短い
検定,委託検定の対象機器は、日照計と直達電気式日射計などである,
アンサンブル予報,アンサンブル平均は、低気圧や台風の中心気圧を低めに予測する,ばらつきを平均するため高めになる。
アンサンブル予報,アンサンブル平均は、局地的な現象をよく表す,隠してしまう。
統計値,降水量が0.0mmと表示されている場合は降水がなかったことを表している,昔は基準がばらばら 現代は-が降水なしで、0.0mmは最小単位以下の降水があった。
統計値,最大一時間雨量は、毎正時の極値である,2002年12月31日以前は。今は、毎10分の極値
統計値,最大一時間雨量は、当日0時1分から25時までの連続した1時間の降水量の最大値である,前日23時1分から当日の24:00まで
統計値,日最大10分間降水量は、当日0時1分から25時までの連続した10時間の降水量の最大値である,前日23時51分から当日の24:00まで
統計値,日最高 最低気温の極値は、毎正時の極値である,任意の時分
統計値,日最大風速と日最大瞬間風速の統計値は気象台等とアメダスでは異なる,同じ 任意の時間の値
統計値,降雪の深さが0cmであれば降雪がなかったことを表す,気象台等（積雪自動観測）では降雪は記録されない 気象台等（目視）はーー表示  アメダスでは、有無に関わらず0cm
統計値,積雪の深さが0cmの時、必ず積雪はなかった。,そう限らない。
数値予報モデル,力学過程は、格子の代表値を用いて直接計算できる時間変化項を取り扱っている,格子内の平均値
数値予報モデル,表現できる現象の最小スケールは、格子間隔の2～4倍と言われている。,5～8倍
数値予報モデル,GSMは非静止力学モデルである,静止力学モデル
数値予報モデル,MSMは静止力学平衡モデルであるが、LFAは非静止力学モデルである,MSMも非静止力学
数値予報モデル,物理過程では、格子より小さいスケールの効果を格子代表値で計算するためのモデル化を行っている,格子平均値
数値予報モデル,MSMでは地表面の積雪が解析値で固定されているために、予報時間中に積雪の有無が変わる効果がそもそも計算されていないが、LFMでは計算されている,MSMもLFMも計算されていない。
数値予報モデル,GSMでは、長時間の予報時間のため海面水温が大気により変化する効果が重要となり計算されている,GSM MSM FLMでも計算されていない。
数値予報モデル,GSMでは、海水温が大気による変化する効果は全く考慮されていない,季節変動は考慮されている。（たぶん季節予報では、何かのパラメータを変えている）
数値予報モデル,GSMでは、積雲対流スキームは大気安定度がそれほど低くない段階から対流が発生するものとして成層を安定させるため、強い降水域を集中させる傾向がある。,弱い降水を広めに予想する傾向がある。
数値予報モデル,MSMでは、地形の収束などの強制力が強いときに、弱い降水を広めに予想する傾向がある,強い降水を集中させる傾向がある。
数値予報モデル,MSMでは、積雲対流スキームによる不安定の解消が十分である場合に、格子スケールの上昇流が弱く予測され、結果として低気圧の発達不足の予報を行うことが知られている。,不十分である場合、低気圧の過発達の予報につながる
数値予報モデル,海上を進む擾乱の予想は、観測点が陸上に比べて少ないが、モデルが単純なため不確実性は小さい,大きい
数値予報モデル,海上を進む擾乱の予想は、衛星による観測データから十分に高精度な初期値を作成することができる,できない
数値予報モデル,台風ボーガスは、典型的な典型的な台風の構造を仮定し、台風の解析及び予測結果をもとに仮想的に作成した風と気圧の場である,
数値予報モデル,MSMやLFMの境界面での親モデルからの影響は、予報時間が長くなるにつれて影響が大きくなる。,
数値予報モデル,親モデルの変更が子モデル内の特性に影響を与えるこない,ある
数値予報モデル,気象庁の数値予報モデルでは、より解像度の高い子モデルから親モデルへの境界面を通しての移流をおこなっている,ない
アンサンブル予報,初期値が古い予報を併せて利用するLAFは気象庁では利用していない,LFM降水量ガイダンスで活用されている。
アンサンブル予報,LAFと新しい予報とに精度の違いは無い,ある 新しい方が平均的には精度が高い
数値予報モデル,数値予報モデルの結果（プロダクト）から格子点と一致しない位置の値を求める場合は、単純な内挿計算で十分である,ならされてしまう。周囲の格子の状態を考慮した方が良い場合がある。
ガイダンス,一括学習型のガイダンスは、係数が変化しやすいため、予測特性を把握しにくい,係数が変化しないから予測特性を把握しやすい
ガイダンス,以下つ学習型のガイダンスは、数値予報モデルが変化してもすぐに対応できる,できない
ガイダンス,ニューラルネットワークは一括学習型の一つである,線形重回帰MLR
ガイダンス,逐次学習型は、数値予報モデルの変更により特性が変化した場合、データが数年かけて蓄積されるのを待たなければならない,一括学習型は
ガイダンス,逐次学習型は、予測式を日々更新できるが、それは1日に1回の更新操作のときだけである,予測のたびに係数が変化する
ガイダンス,逐次学習型は、発生頻度がまれな現象の予測に対しても有効性が高い,低い
ガイダンス,ガイダンスによってランダム誤差の低減が図られる,系統誤差
ガイダンス,ガイダンスはｍ数値予報モデルの地形モデルが実際と異なることによる誤差を低減することが可能である,ある
ガイダンス,線形重回帰は、多次元にわたる複雑な数式であるため、係数からガイダンスの特性をユーザーが把握することが難しい,超単純だから特性の把握しやすい
ガイダンス,線形重回帰は、数値予報結果と観測データから統計処理して係数を決める,最小二乗法も統計処理？
ガイダンス,線形重回帰は、数値予報モデルの変更に対して、ガイダンスの特性をユーザーが把握しやすいことから、柔軟に対応できる,できない
ガイダンス,ロジスティック回帰は、現象の晴れ(1) 雨(0) 雪(-1)の確率を利用するものである,"0,1の2値で表現できる現象の確率を予想する。"
ガイダンス,ニューラルネットワークを用いたガイダンスのメリットは、非線形の関係を取集扱うことができることである,できる。
ガイダンス,ニューラルネットワークを用いると、説明変数と予測結果との関係を把握することが困難である。,
ガイダンス,頻度バイアス補正、平均的な予測誤差が多少悪くなっても発生頻度の低い現象の予測精度を上げる目的で使用される。,
ガイダンス,頻度バイアス補正は、強風や大雨などの空振り率を低下させることができるが、一方捕捉率が悪化してしまう。,頻度バイアス補正は、強風や大雨などの捕捉率を向上させることができるが、一方空振り率が増加してしまう。
ガイダンス,係数の層別化は、一つの予測式ですべての場合に対応するコトは困難なため、特定の条件により予測式の係数を複数使い分ける,
ガイダンス,診断的な手法は、予測式は論理的な関係や簡便な調査結果などをもとに作成し、格子毎に細かい調整を行って得られう,格子毎に調整を行わずにかんたんに作成できる
ガイダンス,降水ガイダンスは、ニューラルネットワークにより平均降水量の予測値を作成し、カルマンフィルターと頻度バイアス補正により解析雨量から算出した平均雨量と最大降水量の比を予測して、最後に両者をかけ合わせて最大降水量を作成する。,カルマンフィルターと頻度バイアス補正で平均雨量の予測値を作成し、ニューラルネットワークにより平均雨量と最大降水量の比を予測して、最大降水量を作成する。
ガイダンス,最大降雪量ガイダンスは、気温ガイダンスとと数値予報モデルの相対湿度から計算された雪水比を平均降水量ガイダンスに×て作成する、,
2週間気温予報,第一種の予測可能性、初期値に依らず境界値によるもの,初期値
2週間気温予報,第2種の予測可能性、境界値によらず初期値によるもの,境界値
2週間気温予報,2週間気温予報が対象とする現象は、移動性の高・低気圧の時間スケールである,時間スケールも空間スケールも大きい
2週間気温予報,定常ロスビー波は重要なファクターである。,
長期予報,ある地域と遠く離れた地域の天候が同期して変動することがあり、これを気象パターンという,テレコレクション
長期予報,ユーラシアパターンは、定常ロスビー波によるものである,らしい
長期予報,ユーラシアパターンは、日本の夏の天候に影響を与える,冬
長期予報,ユーラシアパターンは、ヨーロッパの気圧や気温と日本の気圧や気温が逆になるパターンである,
長期予報,太平洋ー北米パターンは、夏季に卓越するテレコネクションパターンである,
長期予報,PNAパターンは、エルニーニョ・南方振動（ENSO）に伴う熱帯域の変動に対応する応答である,
長期予報,PJパターンは冬の日本の天候に重要である。,
長期予報,PJパターンは、フィリピン付近で低気圧性の時本州付近は後期合う制の南北双極子敵な循環偏差をもつ,
長期予報,PJパターンは対流圏下層だけでみられる,上層にも波列状のパターンが表れる。
長期予報,シルクロードパターンは日本の冬の天候に影響を及ぼす,夏
長期予報,シルクロードパターンは日本付近でジェット気流が北に蛇行すると、対流圏の中下層の太平洋高気圧も日本付近へ張り出す。,
長期予報,PJパターンとシルクロードパターンが重なり合うこない,重なると顕著な高温となりやすい。
長期予報,ブロッキング高気圧は、中高緯度帯の偏西風が南に大きく蛇行し、空間スケールの大きな高気圧が発達して1週間以上停滞したもの,北に蛇行
長期予報,ブロッキング高気圧は、移動性の低気圧がブロッキング高気圧におって東進が阻害されることからこう呼ばれる。,高気圧
長期予報,多くの国の機関では、台風の進路予測には、複数の数値余殃モデルの進路予想結果を平均する手法を導入している。,
長期予報,複数の数値予報モデルの進路予想結果を平均する手法をアンサンブルと呼ばれる,コンセンサス手法
長期予報,コンセンサス手法は、精度が高く独立性の低い数値予報モデルを活用することが効果的である,独立性が高く
長期予報,コンセンサス手法は、特に短いリードタイムの予測では単独モデル予測よりも精度が高くなる。,長いリードタイム
長期予報,単純コンセンサス手法、各数値予報モデルの進路予測結果を単純平均する手法である,
長期予報,コンセンサス手法は、アンサンブル予報のコントロールメンバーよりも精度が劣る,勝る
長期予報,コンセンサス手法は、高解像度の決定論的数予報モデルの予測より十分精度がよい,よいいえない。
長期予報,台風進路予報において、アンサンブル予報は、スプレッドの大きさから予報の信頼度を得る目的で活用されている。,
長期予報,,
雨量指数,土壌雨量指数解析値の解像度と頻度は、1km 10分毎である,5km 30分？
雨量指数,土壌雨量指数実況値の解像度と頻度は、5km 30分である,1km 10分？
雨量指数,土壌・表面・流域雨量指数実況地は、解析雨量からのみ計算される ,速報版解析雨量も用いる。
雨量指数,土壌・表面・流域雨量指数の1時間予報地は、降水短時間予報から求められる,土壌1時間予報は存在しない。降水ナウキャストから求められる。
レーダー,海上での非降水エコーを低減するために、品質管理は関係ない,ある
